### ISSUE TITLE
Android 9 issue

### ISSUE THREAD

**Issue by coresh** [litvinovtd/qeli#96]
Android 9: установка прошла успешно, но после запуска Android-приложения в процессе подключения `android-v9-log` выдает следующее:
Android 9: installed properly, but after the Android app starts, android-v9-log outputs the following during connection:
```
[00:57:28.474] Connecting "My server"
[00:57:28.509] Service started: TCP/fake-tls
[00:57:28.521] Connecting TCP xxx.xxx.xxx.xxx:443...
[00:57:28.568] TCP connected
[00:57:28.582] ERR: [RuntimeException] All X25519 key generation methods failed on API 28
[00:57:28.599] Reconnect attempt 1 in 1s
[00:57:30.014] Connecting TCP xxx.xxx.xxx.xxx:443...
[00:57:30.072] TCP connected
[00:57:30.086] ERR: [RuntimeException] All X25519 key generation methods failed on API 28
[00:57:30.102] Reconnect attempt 2 in 2s
[00:57:32.108] Connecting TCP xxx.xxx.xxx.xxx:443...
[00:57:32.182] TCP connected
[00:57:32.213] ERR: [RuntimeException] All X25519 key generation methods failed on API 28
[00:57:32.243] Reconnect attempt 3 in 4s
[00:57:36.257] Connecting TCP xxx.xxx.xxx.xxx:443...
[00:57:36.338] TCP connected
[00:57:36.369] ERR: [RuntimeException] All X25519 key generation methods failed on API 28
[00:57:36.393] Reconnect attempt 4 in 8s
[00:57:44.402] Connecting TCP xxx.xxx.xxx.xxx:443...
[00:57:44.475] TCP connected
[00:57:44.493] ERR: [RuntimeException] All X25519 key generation methods failed on API 28
[00:57:44.510] Reconnect attempt 5 in 16s
```

Спасибо

**Comment by litvinovtd** [comment]
тестовая сборка попробуйте
https://github.com/litvinovtd/qeli/blob/dev/test/qeli-x25519test.apk

слишком старая версия андроид

**Comment by coresh** [comment]
Re: "https://github.com/litvinovtd/qeli/blob/dev/test/qeli-x25519test.apk":
Всё время: Connecting...
Log:
```
[10:49:19.713] Connecting "My server"
[10:49:22.071] Service started: TCP/fake-tls
[10:49:22.092] Connecting TCP XXX:443...
[10:49:22.175] TCP connected
[10:49:22.206] x25519=native (native lib loaded, API 28, abi arm64-v8a/armeabi-v7a/armeabi)
[10:49:22.211] ClientHello sent (1460B, hybrid X25519+ML-KEM)
[10:49:52.203] TCP connect/handshake exceeded 30s — closing socket to force a reconnect
[10:49:52.216] ERR: [AsynchronousCloseException] null
[10:49:52.257] Reconnect attempt 1 in 1s
[10:49:53.305] Connecting TCP XXX:443...
[10:49:53.387] TCP connected
[10:49:53.433] x25519=native (native lib loaded, API 28, abi arm64-v8a/armeabi-v7a/armeabi)
[10:49:53.447] ClientHello sent (1460B, hybrid X25519+ML-KEM)
[10:50:23.386] TCP connect/handshake exceeded 30s — closing socket to force a reconnect
[10:50:23.423] ERR: [AsynchronousCloseException] null
[10:50:23.477] Reconnect attempt 2 in 2s
[10:50:25.480] Connecting TCP XXX:443...
[10:50:25.566] TCP connected
[10:50:25.619] x25519=native (native lib loaded, API 28, abi arm64-v8a/armeabi-v7a/armeabi)
[10:50:25.632] ClientHello sent (1460B, hybrid X25519+ML-KEM)
[10:50:55.608] TCP connect/handshake exceeded 30s — closing socket to force a reconnect
[10:50:55.618] ERR: [AsynchronousCloseException] null
[10:50:55.629] Reconnect attempt 3 in 4s
[10:50:59.624] Connecting TCP XXX:443...
[10:50:59.705] TCP connected
[10:50:59.758] x25519=native (native lib loaded, API 28, abi arm64-v8a/armeabi-v7a/armeabi)
[10:50:59.769] ClientHello sent (1460B, hybrid X25519+ML-KEM)
[10:51:29.708] TCP connect/handshake exceeded 30s — closing socket to force a reconnect
[10:51:29.724] ERR: [AsynchronousCloseException] null
[10:51:29.777] Reconnect attempt 4 in 8s
[10:51:37.764] Connecting TCP XXX:443...
[10:51:37.839] TCP connected
[10:51:37.875] x25519=native (native lib loaded, API 28, abi arm64-v8a/armeabi-v7a/armeabi)
[10:51:37.910] ClientHello sent (1460B, hybrid X25519+ML-KEM)
[10:52:07.855] TCP connect/handshake exceeded 30s — closing socket to force a reconnect
[10:52:07.904] ERR: [AsynchronousCloseException] null
[10:52:07.948] Reconnect attempt 5 in 16s
[10:52:23.964] Connecting TCP XXX:443...
[10:52:24.067] TCP connected
[10:52:24.122] x25519=native (native lib loaded, API 28, abi arm64-v8a/armeabi-v7a/armeabi)
[10:52:24.137] ClientHello sent (1460B, hybrid X25519+ML-KEM)
[10:52:54.057] TCP connect/handshake exceeded 30s — closing socket to force a reconnect
[10:52:54.082] ERR: [AsynchronousCloseException] null
[10:52:54.137] Reconnect attempt 6 in 32s
[10:53:26.141] Connecting TCP XXX:443...
[10:53:26.250] TCP connected
[10:53:26.277] x25519=native (native lib loaded, API 28, abi arm64-v8a/armeabi-v7a/armeabi)
[10:53:26.288] ClientHello sent (1460B, hybrid X25519+ML-KEM)
[10:53:56.194] TCP connect/handshake exceeded 30s — closing socket to force a reconnect
[10:53:56.213] ERR: [AsynchronousCloseException] null
[10:53:56.219] Reconnect attempt 7 in 60s
[10:54:30.415] Disconnecting…
[10:54:31.750] Connecting "My server"
[10:54:31.814] Service started: TCP/fake-tls
[10:54:31.825] Connecting TCP XXX:443...
[10:54:31.875] TCP connected
[10:54:31.895] x25519=native (native lib loaded, API 28, abi arm64-v8a/armeabi-v7a/armeabi)
[10:54:31.902] ClientHello sent (1460B, hybrid X25519+ML-KEM)

```

Спасибо

**Comment by litvinovtd** [comment]
нужен еще серверный лог

**Comment by coresh** [comment]
```
docker compose logs -f -n 100 qeli-server
```

```
qeli-server  | 2026-07-29 08:45:17.940 INFO  qeli: Starting server (supervisor) with config: /etc/qeli/server.conf
qeli-server  | 2026-07-29 08:45:17.945 WARN  qeli::server: web.enabled is false — the supervisor has no panel to serve
qeli-server  | 2026-07-29 08:45:17.945 INFO  qeli::server: qeli v0.7.13 — control plane up (1 profile(s), panel off)
qeli-server  | 2026-07-29 08:45:17.946 INFO  qeli::server: supervisor: data-plane worker started (pid 33)
qeli-server  | 2026-07-29 08:45:17.954 INFO  qeli: Starting data-plane worker with config: /etc/qeli/server.conf
qeli-server  | 2026-07-29 08:45:17.954 WARN  qeli::server: profile 'tcp': wire mode 'fake-tls' has LOW DPI resistance (plaintext TLS handshake records on the wire). Prefer reality-tls (obf.tls.reality_proxy.real_tls=true + handrolled=true) or obfs on hostile networks.
qeli-server  | 2026-07-29 08:45:17.954 INFO  qeli::server: Loaded 2 user(s) (0 inline in config, rest from '/etc/qeli/users.conf')
qeli-server  | 2026-07-29 08:45:17.955 INFO  qeli::server::control: Control socket listening on /var/run/qeli/control.sock
qeli-server  | 2026-07-29 08:45:17.960 INFO  qeli::server: Starting profile 'tcp' (tcp://0.0.0.0:443)
qeli-server  | 2026-07-29 08:45:17.991 INFO  qeli::server: Profile 'tcp': TUN vpn0 is up with 24 queue(s) (10.9.0.1 255.255.255.0)
qeli-server  | 2026-07-29 08:45:18.003 INFO  qeli::server::nat: Profile 'tcp': forward_private — ip_forward + FORWARD ACCEPT for vpn0 (routing, no NAT)
qeli-server  | 2026-07-29 08:45:18.021 INFO  qeli::server: Profile 'tcp': loaded identity key from /etc/qeli/identity/tcp.key
qeli-server  | 2026-07-29 08:45:18.021 INFO  qeli::server: Profile 'tcp': server identity public key (pin on client): d7d0fd7c1b59ac366b4e167ca94cd91b48c6a24f47810e875af5c3f9d8bf3a09
qeli-server  | 2026-07-29 08:45:18.023 INFO  qeli::server: TUN writer q0 for profile 'tcp' started
qeli-server  | 2026-07-29 08:45:18.025 INFO  qeli::server: TUN writer q1 for profile 'tcp' started
qeli-server  | 2026-07-29 08:45:18.030 INFO  qeli::server: Profile 'tcp' listening on 0.0.0.0:443 (TCP)
qeli-server  | 2026-07-29 08:45:18.036 INFO  qeli::server: TUN writer q3 for profile 'tcp' started
qeli-server  | 2026-07-29 08:45:18.037 INFO  qeli::server: TUN writer q2 for profile 'tcp' started
qeli-server  | 2026-07-29 08:45:18.038 INFO  qeli::server: TUN writer q4 for profile 'tcp' started
qeli-server  | 2026-07-29 08:45:18.039 INFO  qeli::server: TUN writer q5 for profile 'tcp' started
qeli-server  | 2026-07-29 08:45:18.041 INFO  qeli::server: TUN reader q0 for profile 'tcp' started
qeli-server  | 2026-07-29 08:45:18.041 INFO  qeli::server: TUN writer q8 for profile 'tcp' started
qeli-server  | 2026-07-29 08:45:18.042 INFO  qeli::server: TUN writer q7 for profile 'tcp' started
qeli-server  | 2026-07-29 08:45:18.043 INFO  qeli::server: TUN writer q6 for profile 'tcp' started
qeli-server  | 2026-07-29 08:45:18.059 INFO  qeli::server: TUN writer q9 for profile 'tcp' started
qeli-server  | 2026-07-29 08:45:18.059 INFO  qeli::server: TUN writer q11 for profile 'tcp' started
qeli-server  | 2026-07-29 08:45:18.061 INFO  qeli::server: TUN writer q10 for profile 'tcp' started
qeli-server  | 2026-07-29 08:45:18.062 INFO  qeli::server: TUN writer q12 for profile 'tcp' started
qeli-server  | 2026-07-29 08:45:18.063 INFO  qeli::server: TUN writer q13 for profile 'tcp' started
qeli-server  | 2026-07-29 08:45:18.065 INFO  qeli::server: TUN writer q15 for profile 'tcp' started
qeli-server  | 2026-07-29 08:45:18.065 INFO  qeli::server: TUN reader q1 for profile 'tcp' started
qeli-server  | 2026-07-29 08:45:18.065 INFO  qeli::server: TUN reader q2 for profile 'tcp' started
qeli-server  | 2026-07-29 08:45:18.065 INFO  qeli::server: TUN reader q3 for profile 'tcp' started
qeli-server  | 2026-07-29 08:45:18.065 INFO  qeli::server: TUN reader q4 for profile 'tcp' started
qeli-server  | 2026-07-29 08:45:18.066 INFO  qeli::server: TUN writer q14 for profile 'tcp' started
qeli-server  | 2026-07-29 08:45:18.066 INFO  qeli::server: TUN reader q5 for profile 'tcp' started
qeli-server  | 2026-07-29 08:45:18.067 INFO  qeli::server: TUN writer q16 for profile 'tcp' started
qeli-server  | 2026-07-29 08:45:18.068 INFO  qeli::server: TUN writer q17 for profile 'tcp' started
qeli-server  | 2026-07-29 08:45:18.069 INFO  qeli::server: TUN writer q18 for profile 'tcp' started
qeli-server  | 2026-07-29 08:45:18.071 INFO  qeli::server: TUN writer q19 for profile 'tcp' started
qeli-server  | 2026-07-29 08:45:18.072 INFO  qeli::server: TUN writer q20 for profile 'tcp' started
qeli-server  | 2026-07-29 08:45:18.073 INFO  qeli::server: TUN writer q21 for profile 'tcp' started
qeli-server  | 2026-07-29 08:45:18.073 INFO  qeli::server: TUN reader q6 for profile 'tcp' started
qeli-server  | 2026-07-29 08:45:18.074 INFO  qeli::server: TUN reader q7 for profile 'tcp' started
qeli-server  | 2026-07-29 08:45:18.074 INFO  qeli::server: TUN reader q8 for profile 'tcp' started
qeli-server  | 2026-07-29 08:45:18.074 INFO  qeli::server: TUN reader q9 for profile 'tcp' started
qeli-server  | 2026-07-29 08:45:18.074 INFO  qeli::server: TUN reader q10 for profile 'tcp' started
qeli-server  | 2026-07-29 08:45:18.074 INFO  qeli::server: TUN reader q11 for profile 'tcp' started
qeli-server  | 2026-07-29 08:45:18.075 INFO  qeli::server: TUN writer q22 for profile 'tcp' started
qeli-server  | 2026-07-29 08:45:18.075 INFO  qeli::server: TUN reader q12 for profile 'tcp' started
qeli-server  | 2026-07-29 08:45:18.075 INFO  qeli::server: TUN reader q13 for profile 'tcp' started
qeli-server  | 2026-07-29 08:45:18.075 INFO  qeli::server: TUN reader q14 for profile 'tcp' started
qeli-server  | 2026-07-29 08:45:18.075 INFO  qeli::server: TUN reader q15 for profile 'tcp' started
qeli-server  | 2026-07-29 08:45:18.075 INFO  qeli::server: TUN reader q16 for profile 'tcp' started
qeli-server  | 2026-07-29 08:45:18.075 INFO  qeli::server: TUN reader q18 for profile 'tcp' started
qeli-server  | 2026-07-29 08:45:18.075 INFO  qeli::server: TUN reader q19 for profile 'tcp' started
qeli-server  | 2026-07-29 08:45:18.075 INFO  qeli::server: TUN reader q17 for profile 'tcp' started
qeli-server  | 2026-07-29 08:45:18.075 INFO  qeli::server: TUN reader q20 for profile 'tcp' started
qeli-server  | 2026-07-29 08:45:18.075 INFO  qeli::server: TUN reader q21 for profile 'tcp' started
qeli-server  | 2026-07-29 08:45:18.075 INFO  qeli::server: TUN reader q22 for profile 'tcp' started
qeli-server  | 2026-07-29 08:45:18.075 INFO  qeli::server: TUN reader q23 for profile 'tcp' started
qeli-server  | 2026-07-29 08:45:18.076 INFO  qeli::server: TUN writer q23 for profile 'tcp' started
qeli-server  | 2026-07-29 08:45:35.474 INFO  qeli::server: New TCP connection from 172.18.0.1:56462 on profile 'tcp'
qeli-server  | 2026-07-29 08:45:39.211 INFO  qeli::server: New TCP connection from 172.18.0.1:56472 on profile 'tcp'
qeli-server  | 2026-07-29 08:45:39.211 DEBUG qeli::server: Client 172.18.0.1:56472 disconnected on profile 'tcp': handshake failed for 172.18.0.1:56472: failed to read ClientHello: connection closed
qeli-server  | 2026-07-29 08:45:45.475 DEBUG qeli::server: Client 172.18.0.1:56462 disconnected on profile 'tcp': handshake timeout for 172.18.0.1:56462
qeli-server  | 2026-07-29 08:45:46.179 INFO  qeli::server: New TCP connection from 172.18.0.1:39848 on profile 'tcp'
qeli-server  | 2026-07-29 08:45:53.272 INFO  qeli::server: New TCP connection from 172.18.0.1:43126 on profile 'tcp'
qeli-server  | 2026-07-29 08:45:56.180 DEBUG qeli::server: Client 172.18.0.1:39848 disconnected on profile 'tcp': handshake timeout for 172.18.0.1:39848
qeli-server  | 2026-07-29 08:46:01.633 INFO  qeli::server: New TCP connection from 172.18.0.1:49308 on profile 'tcp'
qeli-server  | 2026-07-29 08:46:03.274 DEBUG qeli::server: Client 172.18.0.1:43126 disconnected on profile 'tcp': handshake timeout for 172.18.0.1:43126
qeli-server  | 2026-07-29 08:46:05.956 INFO  qeli::server: New TCP connection from 172.18.0.1:49316 on profile 'tcp'
qeli-server  | 2026-07-29 08:46:11.634 DEBUG qeli::server: Client 172.18.0.1:49308 disconnected on profile 'tcp': handshake timeout for 172.18.0.1:49308
qeli-server  | 2026-07-29 08:46:15.958 DEBUG qeli::server: Client 172.18.0.1:49316 disconnected on profile 'tcp': handshake timeout for 172.18.0.1:49316

qeli-server  | 2026-07-29 08:46:37.041 INFO  qeli::server: New TCP connection from 172.18.0.1:36408 on profile 'tcp'
qeli-server  | 2026-07-29 08:46:47.043 DEBUG qeli::server: Client 172.18.0.1:36408 disconnected on profile 'tcp': handshake timeout for 172.18.0.1:36408
qeli-server  | 2026-07-29 08:47:09.252 INFO  qeli::server: New TCP connection from 172.18.0.1:59942 on profile 'tcp'
```

**Comment by litvinovtd** [comment]
на хосте докера не внутри
iptables -t mangle -A POSTROUTING -p tcp --sport 443 --tcp-flags SYN,RST SYN -j TCPMSS --set-mss 1240
iptables -t mangle -A PREROUTING -p tcp --dport 443 --tcp-flags SYN,RST SYN -j TCPMSS --set-mss 1240
iptables -t mangle -L -n -v | grep TCPMSS

и попробовать поиграться с мту

это похоже на черную дыру PMTU

**Comment by litvinovtd** [comment]
Вы рекомендуемые настройки внесли? Дайте обратную связь.

**Comment by coresh** [comment]
```
cat docker-compose.yml 
# qeli — Linux example. Build the image first (from the repo root):
#   docker buildx build -f release/docker/Dockerfile -t qeli:latest --load .
# Then:  docker compose -f release/docker/docker-compose.yml up -d qeli-server
#
# First start seeds ./data/server/etc/server.conf from the example (and an empty
# users.conf) — edit server.conf (set bind), then add users with:
#   docker exec qeli-server qeli add-client <name> --config /etc/qeli/server.conf
# (they're written to /etc/qeli/users.conf), then restart the service.

services:
  qeli-server:
    environment:
      RUST_LOG: "qeli::server::handler=debug,qeli::server::reality=debug,info"
    image: ghcr.io/litvinovtd/qeli:latest
    container_name: qeli-server
    command: ["server"]                 # uses /etc/qeli/server.conf
    cap_add:
      - NET_ADMIN                        # TUN + iptables/routes
      - NET_RAW
      - NET_BIND_SERVICE                 # bind ports < 1024 (the process itself runs as root)
    devices:
      - "/dev/net/tun:/dev/net/tun"
    sysctls:
      net.ipv4.ip_forward: "1"          # needed for routing.nat.enabled (internet egress)
    volumes:
      - ./data/server/etc:/etc/qeli     # config + identity key — MUST persist
      - ./data/server/lib:/var/lib/qeli # state / TOFU pins
    ports:
      - "443:443/tcp"                   # main wire (match bind.port in server.conf)
      #- "8080:8080/tcp"                 # web panel — set [web] bind=0.0.0.0 + password_hash
    restart: unless-stopped

```

```
tcpdump -ni any 'tcp port 443' -nn -tttt -vv -s 160
tcpdump: data link type LINUX_SLL2
dropped privs to tcpdump
tcpdump: listening on any, link-type LINUX_SLL2 (Linux cooked v2), snapshot length 160 bytes
2026-07-31 19:22:43.848700 eth0  In  IP (tos 0x0, ttl 64, id 48576, offset 0, flags [DF], proto TCP (6), length 60)
    172.18.0.1.50864 > 172.18.0.2.443: Flags [S], cksum 0x5856 (incorrect -> 0x2b5a), seq 3188150936, win 64240, options [mss 1460,sackOK,TS val 4128373359 ecr 0,nop,wscale 7], length 0
2026-07-31 19:22:43.848717 eth0  Out IP (tos 0x0, ttl 64, id 0, offset 0, flags [DF], proto TCP (6), length 60)
    172.18.0.2.443 > 172.18.0.1.50864: Flags [S.], cksum 0x5856 (incorrect -> 0xe8f5), seq 3049577273, ack 3188150937, win 65160, options [mss 1460,sackOK,TS val 4078156456 ecr 4128373359,nop,wscale 7], length 0
2026-07-31 19:22:43.848732 eth0  In  IP (tos 0x0, ttl 64, id 48577, offset 0, flags [DF], proto TCP (6), length 52)
    172.18.0.1.50864 > 172.18.0.2.443: Flags [.], cksum 0x584e (incorrect -> 0x1455), seq 1, ack 1, win 502, options [nop,nop,TS val 4128373359 ecr 4078156456], length 0
2026-07-31 19:22:43.848973 eth0  In  IP (tos 0x0, ttl 64, id 48578, offset 0, flags [DF], proto TCP (6), length 52)
    172.18.0.1.50864 > 172.18.0.2.443: Flags [F.], cksum 0x584e (incorrect -> 0x1454), seq 1, ack 1, win 502, options [nop,nop,TS val 4128373359 ecr 4078156456], length 0
2026-07-31 19:22:43.849060 eth0  Out IP (tos 0x0, ttl 64, id 39140, offset 0, flags [DF], proto TCP (6), length 52)
    172.18.0.2.443 > 172.18.0.1.50864: Flags [F.], cksum 0x584e (incorrect -> 0x144b), seq 1, ack 2, win 510, options [nop,nop,TS val 4078156456 ecr 4128373359], length 0
2026-07-31 19:22:43.849092 eth0  In  IP (tos 0x0, ttl 64, id 48579, offset 0, flags [DF], proto TCP (6), length 52)
    172.18.0.1.50864 > 172.18.0.2.443: Flags [.], cksum 0x584e (incorrect -> 0x1453), seq 2, ack 2, win 502, options [nop,nop,TS val 4128373359 ecr 4078156456], length 0
2026-07-31 19:22:52.057823 eth0  In  IP (tos 0x0, ttl 64, id 54525, offset 0, flags [DF], proto TCP (6), length 60)
    172.18.0.1.57928 > 172.18.0.2.443: Flags [S], cksum 0x5856 (incorrect -> 0x98b5), seq 716913888, win 64240, options [mss 1460,sackOK,TS val 4128381568 ecr 0,nop,wscale 7], length 0
2026-07-31 19:22:52.057846 eth0  Out IP (tos 0x0, ttl 64, id 0, offset 0, flags [DF], proto TCP (6), length 60)
    172.18.0.2.443 > 172.18.0.1.57928: Flags [S.], cksum 0x5856 (incorrect -> 0xc082), seq 1824102914, ack 716913889, win 65160, options [mss 1460,sackOK,TS val 4078164665 ecr 4128381568,nop,wscale 7], length 0
2026-07-31 19:22:52.057864 eth0  In  IP (tos 0x0, ttl 64, id 54526, offset 0, flags [DF], proto TCP (6), length 52)
    172.18.0.1.57928 > 172.18.0.2.443: Flags [.], cksum 0x584e (incorrect -> 0xebe1), seq 1, ack 1, win 502, options [nop,nop,TS val 4128381568 ecr 4078164665], length 0
2026-07-31 19:22:52.057966 eth0  In  IP (tos 0x0, ttl 64, id 54527, offset 0, flags [DF], proto TCP (6), length 52)
    172.18.0.1.57928 > 172.18.0.2.443: Flags [F.], cksum 0x584e (incorrect -> 0xebe0), seq 1, ack 1, win 502, options [nop,nop,TS val 4128381568 ecr 4078164665], length 0
2026-07-31 19:22:52.058069 eth0  Out IP (tos 0x0, ttl 64, id 38974, offset 0, flags [DF], proto TCP (6), length 52)
    172.18.0.2.443 > 172.18.0.1.57928: Flags [F.], cksum 0x584e (incorrect -> 0xebd7), seq 1, ack 2, win 510, options [nop,nop,TS val 4078164665 ecr 4128381568], length 0
2026-07-31 19:22:52.058106 eth0  In  IP (tos 0x0, ttl 64, id 54528, offset 0, flags [DF], proto TCP (6), length 52)
    172.18.0.1.57928 > 172.18.0.2.443: Flags [.], cksum 0x584e (incorrect -> 0xebdf), seq 2, ack 2, win 502, options [nop,nop,TS val 4128381568 ecr 4078164665], length 0
2026-07-31 19:22:52.855075 eth0  In  IP (tos 0x0, ttl 64, id 7497, offset 0, flags [DF], proto TCP (6), length 60)
    172.18.0.1.57930 > 172.18.0.2.443: Flags [S], cksum 0x5856 (incorrect -> 0x5c00), seq 2830170240, win 64240, options [mss 1460,sackOK,TS val 4128382365 ecr 0,nop,wscale 7], length 0
2026-07-31 19:22:52.855110 eth0  Out IP (tos 0x0, ttl 64, id 0, offset 0, flags [DF], proto TCP (6), length 60)
    172.18.0.2.443 > 172.18.0.1.57930: Flags [S.], cksum 0x5856 (incorrect -> 0xc3a2), seq 800691216, ack 2830170241, win 65160, options [mss 1460,sackOK,TS val 4078165462 ecr 4128382365,nop,wscale 7], length 0
2026-07-31 19:22:52.855142 eth0  In  IP (tos 0x0, ttl 64, id 7498, offset 0, flags [DF], proto TCP (6), length 52)
    172.18.0.1.57930 > 172.18.0.2.443: Flags [.], cksum 0x584e (incorrect -> 0xef00), seq 1, ack 1, win 502, options [nop,nop,TS val 4128382366 ecr 4078165462], length 0
2026-07-31 19:22:52.868420 eth0  In  IP (tos 0x0, ttl 64, id 7499, offset 0, flags [DF], proto TCP (6), length 1280)
    172.18.0.1.57930 > 172.18.0.2.443: Flags [P.], seq 1:1229, ack 1, win 502, options [nop,nop,TS val 4128382379 ecr 4078165462], length 1228
2026-07-31 19:22:52.868445 eth0  Out IP (tos 0x0, ttl 64, id 41848, offset 0, flags [DF], proto TCP (6), length 52)
    172.18.0.2.443 > 172.18.0.1.57930: Flags [.], cksum 0x584e (incorrect -> 0xe9fb), seq 1, ack 1229, win 532, options [nop,nop,TS val 4078165476 ecr 4128382379], length 0
2026-07-31 19:23:02.856522 eth0  Out IP (tos 0x0, ttl 64, id 41849, offset 0, flags [DF], proto TCP (6), length 52)
    172.18.0.2.443 > 172.18.0.1.57930: Flags [F.], cksum 0x584e (incorrect -> 0xc2f6), seq 1, ack 1229, win 532, options [nop,nop,TS val 4078175464 ecr 4128382379], length 0
2026-07-31 19:23:02.857129 eth0  In  IP (tos 0x0, ttl 64, id 7500, offset 0, flags [DF], proto TCP (6), length 52)
    172.18.0.1.57930 > 172.18.0.2.443: Flags [.], cksum 0x584e (incorrect -> 0x9c0f), seq 1229, ack 2, win 502, options [nop,nop,TS val 4128392368 ecr 4078175464], length 0

```

Этот дамп уже почти локализовал неисправность: клиент передал в контейнер только 1228 байт, сервер их подтвердил, затем ровно через 10 секунд сам закрыл соединение. Значит Docker, NAT и базовый TCP работают; сервер ждёт недостающую часть ClientHello. Сейчас сверю это с реализацией QELI и дам точечную проверку.

Главный вывод усилился: это не обычный PMTU black hole. Первый сегмент имеет ровно 1228 байт данных и успешно подтверждён, а оставшиеся примерно 232 байта вообще не появляются и не ретранслируются. Такое очень похоже на частичную запись SocketChannel.write() в Android-клиенте, где код считает, что отправил весь буфер после одного вызова.

Для  проверки просьба добавьте временный лог:

broadcastLog(
    "TCP write chunk: written=$written, " +
    "progress=${off + written}/${data.size}"
)

перед:
off += written
Ожидаемый здоровый лог:
```
TCP write chunk: written=1228, progress=1228/1460
TCP write chunk: written=232, progress=1460/1460
ClientHello sent (1460B, hybrid X25519+ML-KEM)
```
Если будет только первая строка, Android-поток завис внутри второго channel.write(). Если обе строки есть, а внешний tcpdump не видит вторую часть, проблема уже в сетевом пути.

Наиболее вероятная картина сейчас: внешний путь имеет MTU 1280, первая часть 1228 успешно проходит, а точное место исчезновения последних 232 байт покажет только capture на WAN-интерфейсе. Внутренний Docker capture уже подтверждает, что сервер и контейнер работают штатно и закрывают соединение исключительно из-за неполного ClientHello.



Дамп показывает причину гораздо точнее:

ClientHello в приложении: 1460 байт
Дошло до QELI-сервера:      1228 байт
Не дошло:                   232 байта

Сервер подтвердил полученные 1228 байт:

seq 1:1229, length 1228
ack 1229

Затем новых данных не было, и ровно через 10 секунд сервер отправил FIN. Это совпадает со стандартным perf.connection.handshake_timeout_secs = 10 в QELI. Сервер не получил полный TLS-record и поэтому физически не мог сформировать ServerHello.

Что означает размер 1228

Пакет имеет:

IP length 1280
TCP payload 1228

То есть:

1280 − 20 байт IPv4 − 32 байта TCP с options = 1228

Где-то на внешнем пути уже действует ограничение MTU около 1280 байт. Это объясняет разбиение ClientHello, но не объясняет, почему оставшиеся 232 байта совсем не появились.

Важная особенность этого tcpdump

Вы снимали трафик внутри контейнера:

172.18.0.1 → 172.18.0.2:443

Поэтому вы видите внутреннее соединение Docker host/proxy → container, а не обязательно исходное Android → public server.

Из-за этого:

options [mss 1460]

внутри контейнера не доказывает, что Android получил MSS 1460. Внешний SYN-ACK мог иметь MSS 1240, а внутренний Docker TCP-leg — собственный MSS 1460.

```
Возможны три результата

Вариант 1 — Android отправляет только 1228 байт

Во внешнем capture будет один пакет:

seq 1:1229 length 1228

И вообще не будет пакета:

seq 1229:1461 length 232

Тогда проблема в Android-клиенте: оставшаяся часть не была передана TCP-стеку.

Вариант 2 — Android ретранслирует последние 232 байта

Будут повторяться пакеты с одинаковым sequence number, например:

seq 1229:1461 length 232
seq 1229:1461 length 232
seq 1229:1461 length 232

Тогда сегмент отбрасывается между Android и сервером: оператором, промежуточным VPN, DPI или сетевым оборудованием.

Вариант 3 — снаружи приходят все 1460 байт

Но внутри контейнера остаётся только 1228. Тогда неисправность находится в Docker port forwarding/userland proxy.
```

Спасибо

**Comment by coresh** [comment]
```
ByteBuffer.wrap(data, off, length) создаёт буфер с position=off и limit=off+length, поэтому следующая итерация действительно отправляет оставшуюся часть.

Более того, в QELI:

канал работает в blocking mode;
установлен TCP_NODELAY;
ClientHello sent (...) выводится после возврата из transport.send();
для fake-tls TcpTransport.send() напрямую вызывает writeFully() → writeRaw() без изменения размера данных.

То есть появление строки:

ClientHello sent (1460B, hybrid X25519+ML-KEM)

означает, что цикл writeRaw() завершился и приложение передало все 1460 байт TCP-стеку.

Что теперь доказано tcpdump

На WAN-интерфейсе видно:

client SYN:     mss 1360
server SYN-ACK: mss 1240

client → server:
seq 1:1229
length 1228

server → client:
ack 1229

После этого продолжение seq 1229:1461 на сервер вообще не пришло.

Значит отсутствующие 232 байта находятся не в Docker и не в серверном QELI. Остались две основные версии:

APK фактически собран не из показанного исходника.
Android передал 1460 байт ядру, но второй TCP-сегмент размером около 232 байт отбрасывается оператором, DPI, промежуточным VPN или другим узлом между телефоном и сервером.

Вторая версия сейчас наиболее вероятна.

Просьба добавить точный контроль записи:

На время диагностики замените writeRaw() на:

fun writeRaw(data: ByteArray) {
    synchronized(writeLock) {
        val buffer = ByteBuffer.wrap(data)
        var call = 0
        var total = 0

        while (buffer.hasRemaining()) {
            call++

            val before = buffer.remaining()
            val n = channel.write(buffer)

            if (n < 0) {
                throw Exception("Connection closed")
            }

            if (n == 0) {
                Thread.yield()
                continue
            }

            total += n

            if (data.size >= 1000) {
                broadcastLog(
                    "writeRaw: call=$call wrote=$n " +
                    "before=$before total=$total/${data.size}"
                )
            }
        }

        if (data.size >= 1000) {
            broadcastLog(
                "writeRaw complete: calls=$call total=$total/${data.size}"
            )
        }
    }
}

После пересборки APK ожидается один из вариантов.

Вариант A
writeRaw: call=1 wrote=1460 total=1460/1460
writeRaw complete: calls=1 total=1460/1460

Это означает: QELI передал всё ядру одним вызовом, а разделение 1228 + 232 произошло уже в TCP-стеке. Второй сегмент потерялся на сетевом пути.

Вариант B
writeRaw: call=1 wrote=1228 total=1228/1460
writeRaw: call=2 wrote=232 total=1460/1460
writeRaw complete: calls=2 total=1460/1460

Результат тот же: приложение отправило всё, но второй сегмент не дошёл до сервера.

Вариант C

Лог writeRaw complete отсутствует, но старый лог ClientHello sent всё равно появляется.

Тогда на телефоне запущен другой APK или другая версия класса.

Добавьте для проверки сборки уникальный маркер:

broadcastLog("BUILD MARKER: TCP_WRITE_PROBE_2026_07_31")

и убедитесь, что он появляется после установки APK.
```

Спасибо

**Comment by litvinovtd** [comment]
Спасибо за дамп — он снимает почти все вопросы, но выводы получаются другие.

**Гипотеза о частичной записи не подтверждается.** Цикл, который предлагается добавить, в клиенте уже есть — отправка идёт именно так:

```kotlin
var off = 0
while (off < data.size) {
    val n = channel.write(ByteBuffer.wrap(data, off, data.size - off))
    if (n < 0) throw Exception("Connection closed")
    off += n
}
```

То есть «вариант B» — это и есть текущее поведение, отдельная сборка для его проверки не нужна.

Больше того, **это доказывает уже присланный лог**. Строка `ClientHello sent (1460B…)` печатается **после** возврата из отправки. Она в логе есть — значит цикл дошёл до конца и все 1460 байт переданы ядру. При частичной записи или зависании внутри второго вызова этой строки бы не было, а был бы обрыв на предыдущей.

**Важное ограничение дампа.** Он снят внутри контейнера, и источник в нём — `172.18.0.1`, шлюз docker-бриджа, а не адрес телефона. Значит перед этой точкой есть трансляция адресов (а возможно и userland-релей Docker), и внешнее плечо соединения в этот дамп не попадает. Поэтому отсутствие ретрансмиссий здесь **не** означает, что телефон их не слал: пересылается только то, что успешно принято снаружи.

**Что дамп действительно доказывает:** сервер и контейнер отработали штатно. Приняли 1228 байт, подтвердили, честно подождали 10 секунд (`handshake_timeout_secs`) и закрыли — с неполной TLS-записью иначе и нельзя.

**Почему это, скорее всего, не PMTU.** 1228 = 1280 − 52, то есть телефон уже знает про MTU 1280 и сам нарезал 1460 на 1228 + 232. **Оба сегмента меньше MTU.** При чёрной дыре PMTU терялся бы крупный пакет, а мелкий проходил — здесь ровно наоборот. Соединение устанавливается, начало приветствия проходит, дальше поток глохнет — это больше похоже на инспекцию трафика: промежуточный узел успевает разобрать начало TLS-приветствия и после этого гасит соединение.

Косвенно на это указывает предупреждение самого сервера в вашем же логе:

> wire mode 'fake-tls' has LOW DPI resistance (plaintext TLS handshake records on the wire)

`fake-tls` отправляет открытое TLS-приветствие с подставным именем сайта на голый IP — это распознаваемый признак.

**Что стоит сделать по порядку:**

1. Снять дамп на **внешнем интерфейсе хоста**, а не внутри контейнера:

   ```
   tcpdump -ni <wan> 'tcp port 443' -nn -tttt
   ```

   Если там видны повторные отправки 232-байтного сегмента, которые не проходят дальше — вопрос закрыт, дело в пути. Если их нет вообще — тогда действительно стоит смотреть клиент, и вот тогда отладочная сборка будет к месту.

2. Попробовать подключиться **с другой сети** (Wi-Fi вместо мобильного интернета) — быстрый способ отделить сеть от всего остального.

3. Сменить режим на **reality-tls** или **obfs** — если причина в инспекции трафика, это самый вероятный обход. Либо попробовать UDP-профиль: другой транспорт инспектируется иначе.

**Отдельно, не по теме проблемы.** В логе видно `forward_private … (routing, no NAT)` — NAT выключен. Когда подключение заработает, интернета у клиента всё равно не будет: пакеты уйдут с внутренним адресом и не вернутся. Для обычного полного туннеля нужно `routing.nat.enabled = true` в профиле.

**Comment by coresh** [comment]
Подёргали одеяло с чатом-гпт друг у друга, положительный результат - отсутсвует

Просьба скинуть рабочий кофиг для сервера
```
server.conf
```
и рабочий кофиг для профиля клиента,
заменив, чувствительные данные на "кракозябры"

Спасибо

**Comment by litvinovtd** [comment]
Держите. Ниже рабочий `server.conf` сразу с тремя профилями — **reality-tls**, **fake-tls** и **udp-quic** — и клиентские конфиги к каждому. Профили независимы: свой порт, своё имя интерфейса, своя подсеть, свой ключ. Можно поднять все три и переключаться, не меняя конфиг.

Конфиги взяты из поставляемого с проектом примера `server-multiprofile.conf` (он есть в контейнере: `/usr/share/qeli/server-multiprofile.conf.example`). Файл ниже целиком прогнан через `check-config` — отвечает `OK`. Профиль fake-tls в этом виде дополнительно проверен end-to-end на Android 14: хендшейк, авторизация, туннель, пинг.

---

## `server.conf`

```ini
[auth]
users_file = /etc/qeli/users.conf
require_client_key_proof = true
bind_static_to_session = true
brute_force.max_attempts = 5
brute_force.window_secs = 60
brute_force.lockout_secs = 300

[logging]
level = info

[web]
enabled = false
bind = 127.0.0.1
port = 8080

# ─── 1. reality-tls — максимальная устойчивость к DPI ───────────────────────
# Туннель идёт внутри НАСТОЯЩЕЙ TLS-сессии к реальному сайту. Тот, кто смотрит
# со стороны, видит обычный визит на www.microsoft.com.
[profile:reality-tls]
enabled = true
bind.address = 0.0.0.0
bind.port = 443
bind.transport = tcp
tun.name = vpn0
tun.address = 10.9.0.1
tun.netmask = 255.255.255.0
tun.mtu = 1400
tun.queues = 0
pool.cidr = 10.9.0.0/24
pool.exclude = 10.9.0.1
routing.nat.enabled = true
routing.forward_private = true
dns.enabled = true
dns.listen = 10.9.0.1
dns.upstream = 1.1.1.1
obf.mode = reality-tls
obf.tls.server_name = www.microsoft.com
obf.tls.reality_proxy.enabled = true
obf.tls.reality_proxy.target = www.microsoft.com
obf.tls.reality_proxy.target_port = 443
obf.tls.reality_proxy.real_tls = true
obf.tls.reality_proxy.short_ids = ЗАМЕНИТЕ-НА-16-HEX-СИМВОЛОВ
obf.padding.enabled = false
obf.heartbeat.enabled = false
obf.traffic_shaping.enabled = true
obf.traffic_shaping.idle_gap_mean_ms = 700
obf.traffic_shaping.idle_gap_min_ms = 40
obf.traffic_shaping.idle_gap_max_ms = 6000
obf.traffic_shaping.budget_bytes_per_sec = 16384
obf.quic.enabled = false
obf.multipath.enabled = true
obf.multipath.adaptive = true
perf.tcp.nodelay = true
perf.connection.max_clients = 64
perf.connection.handshake_timeout_secs = 10
perf.connection.idle_timeout_secs = 0

# ─── 2. fake-tls — быстрый и простой, но заметный для DPI ───────────────────
[profile:fake-tls]
enabled = true
bind.address = 0.0.0.0
bind.port = 8444
bind.transport = tcp
tun.name = vpn2
tun.address = 10.9.2.1
tun.netmask = 255.255.255.0
tun.mtu = 1400
tun.queues = 0
pool.cidr = 10.9.2.0/24
pool.exclude = 10.9.2.1
routing.nat.enabled = true
routing.forward_private = true
dns.enabled = true
dns.listen = 10.9.2.1
dns.upstream = 1.1.1.1
obf.mode = fake-tls
obf.tls.server_name = www.microsoft.com
obf.padding.enabled = true
obf.padding.min_bytes = 40
obf.padding.max_bytes = 400
obf.heartbeat.enabled = false
obf.traffic_shaping.enabled = true
obf.traffic_shaping.idle_gap_mean_ms = 700
obf.traffic_shaping.idle_gap_min_ms = 40
obf.traffic_shaping.idle_gap_max_ms = 6000
obf.traffic_shaping.budget_bytes_per_sec = 16384
obf.traffic_shaping.min_size = 64
obf.traffic_shaping.max_size = 1024
obf.quic.enabled = false
obf.multipath.enabled = true
obf.multipath.adaptive = true
perf.tcp.nodelay = true
perf.connection.max_clients = 64
perf.connection.handshake_timeout_secs = 10
perf.connection.idle_timeout_secs = 0

# ─── 3. udp-quic — трафик маскируется под QUIC (UDP) ────────────────────────
# Другой транспорт: там, где TCP-поток режут, UDP часто проходит.
[profile:udp-quic]
enabled = true
bind.address = 0.0.0.0
bind.port = 8449
bind.transport = udp
tun.name = vpn7
tun.address = 10.9.7.1
tun.netmask = 255.255.255.0
tun.mtu = 1400
tun.queues = 0
pool.cidr = 10.9.7.0/24
pool.exclude = 10.9.7.1
routing.nat.enabled = true
routing.forward_private = true
dns.enabled = true
dns.listen = 10.9.7.1
dns.upstream = 1.1.1.1
obf.mode = fake-tls
obf.tls.server_name = www.microsoft.com
obf.quic.enabled = true
obf.padding.enabled = true
obf.padding.min_bytes = 40
obf.padding.max_bytes = 400
obf.heartbeat.enabled = false
obf.traffic_shaping.enabled = true
obf.traffic_shaping.idle_gap_mean_ms = 700
obf.traffic_shaping.idle_gap_min_ms = 40
obf.traffic_shaping.idle_gap_max_ms = 6000
obf.traffic_shaping.budget_bytes_per_sec = 16384
obf.traffic_shaping.min_size = 64
obf.traffic_shaping.max_size = 1024
perf.connection.max_clients = 64
perf.connection.handshake_timeout_secs = 10
perf.connection.idle_timeout_secs = 0
```

**Что обязательно заменить:** `short_ids` в профиле reality-tls — любые 16 hex-символов (`openssl rand -hex 8`). Он же указывается на клиенте.

---

## Пользователи и ключи

```bash
# завести пользователя (пароль покажется ОДИН раз, если не задать своим)
docker exec -it qeli-server qeli add-client myphone --config /etc/qeli/server.conf

# публичные ключи профилей — их клиент «пинит» в поле key=
docker exec -it qeli-server qeli show-identity --config /etc/qeli/server.conf
```

У каждого профиля **свой** ключ — для клиента берите строку того профиля, к которому подключаетесь.

Готовую строку `qeli://` для телефона (её можно вставить в приложение или показать QR-кодом):

```bash
docker exec -it qeli-server qeli add-client myphone --link \
    --host ВАШ.IP.ИЛИ.ДОМЕН:443 --link-profile reality-tls --config /etc/qeli/server.conf
```

Для **уже существующего** пользователя ссылку выдаёт (пароль вводить не нужно, он подставится сам):

```bash
docker exec -it qeli-server qeli share-link myphone \
    --host ВАШ.IP.ИЛИ.ДОМЕН:443 --profile reality-tls --config /etc/qeli/server.conf
```

---

## Клиентские конфиги

Для десктопного клиента это файл, для телефона проще вставить `qeli://`-ссылку из команды выше.

**reality-tls** (порт 443):

```ini
[qeli]
server = ВАШ.IP.ИЛИ.ДОМЕН:443
proto = tcp
user = myphone
pass = ПАРОЛЬ
key = КЛЮЧ-ПРОФИЛЯ-reality-tls-ИЗ-show-identity
mode = reality-tls
sni = www.microsoft.com
reality_sid = ТЕ-ЖЕ-16-HEX-ЧТО-В-short_ids
gateway = true
dns = tunnel

[logging]
level = info
```

**fake-tls** (порт 8444):

```ini
[qeli]
server = ВАШ.IP.ИЛИ.ДОМЕН:8444
proto = tcp
user = myphone
pass = ПАРОЛЬ
key = КЛЮЧ-ПРОФИЛЯ-fake-tls
mode = fake-tls
sni = www.microsoft.com
gateway = true
dns = tunnel

[logging]
level = info
```

**udp-quic** (порт 8449, UDP):

```ini
[qeli]
server = ВАШ.IP.ИЛИ.ДОМЕН:8449
proto = udp
user = myphone
pass = ПАРОЛЬ
key = КЛЮЧ-ПРОФИЛЯ-udp-quic
mode = fake-tls
quic = true
sni = www.microsoft.com
gateway = true
dns = tunnel

[logging]
level = info
```

`gateway = true` — весь трафик в туннель. Для выборочной маршрутизации поставьте `false`.

---

## Важно для вашей установки в Docker

**1. Порты.** В вашем `docker-compose.yml` проброшен только 443. Для новых профилей добавьте, иначе снаружи они недоступны — и обратите внимание на `/udp`:

```yaml
    ports:
      - "443:443/tcp"     # reality-tls
      - "8444:8444/tcp"   # fake-tls
      - "8449:8449/udp"   # udp-quic
```

Плюс открыть эти порты в файрволе хостера.

**2. NAT.** В вашем логе было `forward_private … (routing, no NAT)` — NAT выключен, и после подключения интернета у клиента бы не было. В конфигах выше `routing.nat.enabled = true` уже стоит.

**3. Проверка перед стартом:**

```bash
docker exec -it qeli-server qeli check-config --config /etc/qeli/server.conf
```

---

## Что пробовать в вашей ситуации

Начните с **reality-tls на 443**. Ваш обрыв происходит ровно в момент, когда промежуточный узел успевает разглядеть начало TLS-приветствия — а reality-tls прячет туннель внутрь настоящей TLS-сессии к реальному сайту, и разглядывать становится нечего.

Если и он не пойдёт — пробуйте **udp-quic**: это принципиально другой транспорт, и фильтрация TCP-потоков его не касается.

fake-tls оставьте на случай, если оба варианта окажутся не нужны: он самый простой и быстрый, но и самый заметный — сервер о нём предупреждает при старте не просто так.

**Comment by coresh** [comment]
Спасибо огромное за подробные детели и Ваше усилие
